 Welcome to Address Book using MySQL Database
//---------------UC1---------------------


mysql> CREATE DATABASE AddressBook_Service;
Query OK, 1 row affected (0.63 sec)

mysql> show databases;
+---------------------+
| Database            |
+---------------------+
| addressbook_service |
| information_schema  |
| mysql               |
| payroll_service     |
| performance_schema  |
| sys                 |
+---------------------+
6 rows in set (0.12 sec)

mysql> USE addressbook_service;
Database changed
mysql> select database();
+---------------------+
| database()          |
+---------------------+
| addressbook_service |
+---------------------+
1 row in set (0.00 sec)


//-------------------UC2---------------------

mysql> CREATE TABLE addressbook
    -> (
    -> firstName VARCHAR(100) NOT NULL,
    -> lastName  VARCHAR(100) NOT NULL,
    -> address   VARCHAR(100) NOT NULL,
    -> city      VARCHAR(100) NOT NULL,
    -> state     VARCHAR(100) NOT NULL,
    -> zipCode   INT unsigned NOT NULL,
    -> phoneNumber  BIGINT NOT NULL,
    -> email     VARCHAR(100) NOT NULL,
    -> PRIMARY KEY (firstName)
    -> );
Query OK, 0 rows affected (2.30 sec)

mysql> show tables;
+-------------------------------+
| Tables_in_addressbook_service |
+-------------------------------+
| addressbook                   |
+-------------------------------+
1 row in set (0.34 sec)

mysql> DESCRIBE addressbook;
+-------------+--------------+------+-----+---------+-------+
| Field       | Type         | Null | Key | Default | Extra |
+-------------+--------------+------+-----+---------+-------+
| firstName   | varchar(100) | NO   | PRI | NULL    |       |
| lastName    | varchar(100) | NO   |     | NULL    |       |
| address     | varchar(100) | NO   |     | NULL    |       |
| city        | varchar(100) | NO   |     | NULL    |       |
| state       | varchar(100) | NO   |     | NULL    |       |
| zipCode     | int unsigned | NO   |     | NULL    |       |
| phoneNumber | bigint       | NO   |     | NULL    |       |
| email       | varchar(100) | NO   |     | NULL    |       |
+-------------+--------------+------+-----+---------+-------+
8 rows in set (0.13 sec)


//---------------------UC3---------------------------


mysql> INSERT INTO addressbook VALUES
    -> ('Snehal','Patil','Sangli','Sangli','Maharashtra','123456','9876543210','
snehal@gmail.com'),
    -> ('Rushi','Patil','Bangalore','Bangalore','Karnataka','234561','8765432109
','rushi@gmail.com'),
    -> ('Shruti','Gaikawad','Haveri','Haveri','Karnataka','345612','7654321098',
'shruti@gmail.com');
Query OK, 3 rows affected (2.26 sec)
Records: 3  Duplicates: 0  Warnings: 0

mysql> SELECT * FROM addressbook;
+-----------+----------+-----------+-----------+-------------+---------+-------------+------------------+
| firstName | lastName | address   | city      | state       | zipCode | phoneNumber | email            |
+-----------+----------+-----------+-----------+-------------+---------+-------------+------------------+
| Rushi     | Patil    | Bangalore | Bangalore | Karnataka   |  234561 |  8765432109 | rushi@gmail.com  |
| Shruti    | Gaikawad | Haveri    | Haveri    | Karnataka   |  345612 |  7654321098 | shruti@gmail.com |
| Snehal    | Patil    | Sangli    | Sangli    | Maharashtra |  123456 |  9876543210 | snehal@gmail.com |
+-----------+----------+-----------+-----------+-------------+---------+-------------+------------------+
3 rows in set (0.06 sec)


//---------------------UC4--------------------------------


mysql> UPDATE addressbook SET phoneNumber= '99999999999' where firstName= 'Snehal';
Query OK, 1 row affected (0.16 sec)
Rows matched: 1  Changed: 1  Warnings: 0

mysql> SELECT * FROM addressbook;
+-----------+----------+-----------+-----------+-------------+---------+-------------+------------------+
| firstName | lastName | address   | city      | state       | zipCode | phoneNumber | email            |
+-----------+----------+-----------+-----------+-------------+---------+-------------+------------------+
| Rushi     | Patil    | Bangalore | Bangalore | Karnataka   |  234561 |  8765432109 | rushi@gmail.com  |
| Shruti    | Gaikawad | Haveri    | Haveri    | Karnataka   |  345612 |  7654321098 | shruti@gmail.com |
| Snehal    | Patil    | Sangli    | Sangli    | Maharashtra |  123456 |  9999999999 | snehal@gmail.com |
+-----------+----------+-----------+-----------+-------------+---------+-------------+------------------+
3 rows in set (0.02 sec)


//--------------------UC5----------------------------------

mysql> DELETE FROM addressbook where firstName= 'Shruti';
Query OK, 1 row affected (0.13 sec)

mysql> SELECT * FROM addressbook;
+-----------+----------+-----------+-----------+-------------+---------+-------------+------------------+
| firstName | lastName | address   | city      | state       | zipCode | phoneNumber | email            |
+-----------+----------+-----------+-----------+-------------+---------+-------------+------------------+
| Rushi     | Patil    | Bangalore | Bangalore | Karnataka   |  234561 |  8765432109 | rushi@gmail.com  |
| Snehal    | Patil    | Sangli    | Sangli    | Maharashtra |  123456 |  9999999999 | snehal@gmail.com |
+-----------+----------+-----------+-----------+-------------+---------+-------------+------------------+
2 rows in set (0.04 sec)



//-------------------------UC6-----------------------------------


mysql> SELECT * FROM addressbook WHERE city = 'Sangli';
+-----------+----------+---------+--------+-------------+---------+-------------+------------------+
| firstName | lastName | address | city   | state       | zipCode | phoneNumber| email            |
+-----------+----------+---------+--------+-------------+---------+-------------+------------------+
| Snehal    | Patil    | Sangli  | Sangli | Maharashtra |  123456 |  9999999999| snehal@gmail.com |
+-----------+----------+---------+--------+-------------+---------+-------------+------------------+
1 row in set (0.00 sec)

mysql> SELECT * FROM addressbook WHERE state = 'Karnataka';
+-----------+----------+-----------+-----------+-----------+---------+-------------+-----------------+
| firstName | lastName | address   | city      | state     | zipCode | phoneNumber | email           |
+-----------+----------+-----------+-----------+-----------+---------+-------------+-----------------+
| Rushi     | Patil    | Bangalore | Bangalore | Karnataka |  234561 |  8765432109 | rushi@gmail.com |
+-----------+----------+-----------+-----------+-----------+---------+-------------+-----------------+
1 row in set (0.00 sec)


//-----------------------UC7---------------------------------


mysql> SELECT city, COUNT(city) FROM addressbook GROUP by city;
+-----------+-------------+
| city      | COUNT(city) |
+-----------+-------------+
| Bangalore |           1 |
| Sangli    |           1 |
+-----------+-------------+
2 rows in set (0.00 sec)

mysql> SELECT state, COUNT(state) FROM addressbook GROUP by state;
+-------------+--------------+
| state       | COUNT(state) |
+-------------+--------------+
| Karnataka   |            1 |
| Maharashtra |            1 |
+-------------+--------------+
2 rows in set (0.00 sec)


//-----------------------UC8-----------------------------------

mysql> INSERT INTO addressBook VALUES
    -> ('Anjali','Sankpal','Tasgaon','Sangli','Maharashtra',456789,8888888888,'anjali@gmail.com'),
    -> ('Aditya','Sankpal','Solapur','Sangola','Maharashtra',876589,7777777777,'aditya@gmail.com');
Query OK, 2 rows affected (0.12 sec)
Records: 2  Duplicates: 0  Warnings: 0

mysql> SELECT * FROM addressbook;
+-----------+----------+-----------+-----------+-------------+---------+-------------+------------------+
| firstName | lastName | address   | city      | state       | zipCode | phoneNumber | email            |
+-----------+----------+-----------+-----------+-------------+---------+-------------+------------------+
| Aditya    | Sankpal  | Solapur   | Sangola   | Maharashtra |  876589 |  7777777777 | aditya@gmail.com |
| Anjali    | Sankpal  | Tasgaon   | Sangli    | Maharashtra |  456789 |  8888888888 | anjali@gmail.com |
| Rushi     | Patil    | Bangalore | Bangalore | Karnataka   |  234561 |  8765432109 | rushi@gmail.com  |
| Snehal    | Patil    | Sangli    | Sangli    | Maharashtra |  123456 |  9999999999 | snehal@gmail.com |
+-----------+----------+-----------+-----------+-------------+---------+-------------+------------------+
4 rows in set (0.06 sec)

mysql> SELECT firstName from addressbook order by city;
+-----------+
| firstName |
+-----------+
| Rushi     |
| Anjali    |
| Snehal    |
| Aditya    |
+-----------+
4 rows in set (0.00 sec)


//---------------------------UC9---------------------------------

mysql> ALTER TABLE addressBook ADD addressbookName VARCHAR(100) AFTER email;
Query OK, 0 rows affected (1.90 sec)
Records: 0  Duplicates: 0  Warnings: 0

mysql> ALTER TABLE addressbook ADD addressbookType VARCHAR(100) AFTER addressboo
kName;
Query OK, 0 rows affected (0.71 sec)
Records: 0  Duplicates: 0  Warnings: 0

mysql> UPDATE addressbook SET addressbookName = 'AddressBook_1',addressbooktype='Family' WHERE firstName = 'Rushi';
Query OK, 1 row affected (0.13 sec)
Rows matched: 1  Changed: 1  Warnings: 0

mysql> UPDATE addressbook SET addressbookName = 'AddressBook_2',addressbooktype='Friend' WHERE firstName = 'Anjali';
Query OK, 1 row affected (0.25 sec)
Rows matched: 1  Changed: 1  Warnings: 0

mysql> UPDATE addressbook SET addressbookName = 'AddressBook_3',addressbooktype='Family' WHERE firstName = 'Snehal';
Query OK, 1 row affected (1.38 sec)
Rows matched: 1  Changed: 1  Warnings: 0

mysql> UPDATE addressbook SET addressbookName = 'AddressBook_4',addressbooktype='Profession' WHERE firstName = 'Aditya';
Query OK, 1 row affected (0.13 sec)
Rows matched: 1  Changed: 1  Warnings: 0

mysql> SELECT * FROM addressbook;
+-----------+----------+-----------+-----------+-------------+---------+-------------+------------------+-----------------+-----------------+
| firstName | lastName | address   | city      | state       | zipCode | phoneNumber | email            | addressbookName | addressbookType |
+-----------+----------+-----------+-----------+-------------+---------+-------------+------------------+-----------------+-----------------+
| Aditya    | Sankpal  | Solapur   | Sangola   | Maharashtra |  876589 |  7777777777 | aditya@gmail.com | AddressBook_4   | Profession      |
| Anjali    | Sankpal  | Tasgaon   | Sangli    | Maharashtra |  456789 |  8888888888 | anjali@gmail.com | AddressBook_2   | Friend          |
| Rushi     | Patil    | Bangalore | Bangalore | Karnataka   |  234561 |  8765432109 | rushi@gmail.com  | AddressBook_1   | Family          |
| Snehal    | Patil    | Sangli    | Sangli    | Maharashtra |  123456 |  9999999999 | snehal@gmail.com | AddressBook_3   | Family          |
+-----------+----------+-----------+-----------+-------------+---------+-------------+------------------+-----------------+-----------------+
4 rows in set (0.06 sec)

//-------------------------UC10---------------------------

mysql> SELECT addressbookType, COUNT(addressbookType) FROM addressbook GROUP BY addressbookType;
+-----------------+------------------------+
| addressbookType | COUNT(addressbookType) |
+-----------------+------------------------+
| Profession      |                      1 |
| Friend          |                      1 |
| Family          |                      2 |
+-----------------+------------------------+
3 rows in set (0.00 sec)


//------------------------UC11-----------------------------

mysql> INSERT INTO addressBook VALUES
    -> ('Shweta','Shinde','Hubali','Hubali','Karnataka',345678,9898989898,'shwea@gmail.com','AddressBook_5','Friend');
Query OK, 1 row affected (0.76 sec)

mysql> INSERT INTO addressBook VALUES
    -> ("Swara", "Patil", "Gitanagar", "Mumbai", "Maharashtra", 561238, 787877878, "swara@gmail.com", "addressBook_6", "Family");
Query OK, 1 row affected (0.26 sec)

mysql> SELECT * FROM addressbook;
+-----------+----------+-----------+-----------+-------------+---------+------------+------------------+-----------------+-----------------+
| firstName | lastName | address   | city      | state       | zipCode | phoneNmber | email            | addressbookName | addressbookType |
+-----------+----------+-----------+-----------+-------------+---------+------------+------------------+-----------------+-----------------+
| Aditya    | Sankpal  | Solapur   | Sangola   | Maharashtra |  876589 |  777777777 | aditya@gmail.com | AddressBook_4   | Profession      |
| Anjali    | Sankpal  | Tasgaon   | Sangli    | Maharashtra |  456789 |  888888888 | anjali@gmail.com | AddressBook_2   | Friend          |
| Rushi     | Patil    | Bangalore | Bangalore | Karnataka   |  234561 |  876542109 | rushi@gmail.com  | AddressBook_1   | Family          |
| Shweta    | Shinde   | Hubali    | Hubali    | Karnataka   |  345678 |  989899898 | shweta@gmail.com | AddressBook_5   | Friend          |
| Snehal    | Patil    | Sangli    | Sangli    | Maharashtra |  123456 |  999999999 | snehal@gmail.com | AddressBook_3   | Family          |
| Swara     | Patil    | Gitanagar | Mumbai    | Maharashtra |  561238 |  787877878 | swara@gmail.com  | addressBook_6   | Family          |
+-----------+----------+-----------+-----------+-------------+---------+------------+------------------+-----------------+-----------------+
6 rows in set (0.00 sec)

