 Welcome to Address Book using MySQL Database
//---------------UC1---------------------


mysql> CREATE DATABASE AddressBook_Service;
Query OK, 1 row affected (0.63 sec)

mysql> show databases;
+---------------------+
| Database            |
+---------------------+
| addressbook_service |
| information_schema  |
| mysql               |
| payroll_service     |
| performance_schema  |
| sys                 |
+---------------------+
6 rows in set (0.12 sec)

mysql> USE addressbook_service;
Database changed
mysql> select database();
+---------------------+
| database()          |
+---------------------+
| addressbook_service |
+---------------------+
1 row in set (0.00 sec)


//-------------------UC2---------------------

mysql> CREATE TABLE addressbook
    -> (
    -> firstName VARCHAR(100) NOT NULL,
    -> lastName  VARCHAR(100) NOT NULL,
    -> address   VARCHAR(100) NOT NULL,
    -> city      VARCHAR(100) NOT NULL,
    -> state     VARCHAR(100) NOT NULL,
    -> zipCode   INT unsigned NOT NULL,
    -> phoneNumber  BIGINT NOT NULL,
    -> email     VARCHAR(100) NOT NULL,
    -> PRIMARY KEY (firstName)
    -> );
Query OK, 0 rows affected (2.30 sec)

mysql> show tables;
+-------------------------------+
| Tables_in_addressbook_service |
+-------------------------------+
| addressbook                   |
+-------------------------------+
1 row in set (0.34 sec)

mysql> DESCRIBE addressbook;
+-------------+--------------+------+-----+---------+-------+
| Field       | Type         | Null | Key | Default | Extra |
+-------------+--------------+------+-----+---------+-------+
| firstName   | varchar(100) | NO   | PRI | NULL    |       |
| lastName    | varchar(100) | NO   |     | NULL    |       |
| address     | varchar(100) | NO   |     | NULL    |       |
| city        | varchar(100) | NO   |     | NULL    |       |
| state       | varchar(100) | NO   |     | NULL    |       |
| zipCode     | int unsigned | NO   |     | NULL    |       |
| phoneNumber | bigint       | NO   |     | NULL    |       |
| email       | varchar(100) | NO   |     | NULL    |       |
+-------------+--------------+------+-----+---------+-------+
8 rows in set (0.13 sec)


//---------------------UC3---------------------------


mysql> INSERT INTO addressbook VALUES
    -> ('Snehal','Patil','Sangli','Sangli','Maharashtra','123456','9876543210','
snehal@gmail.com'),
    -> ('Rushi','Patil','Bangalore','Bangalore','Karnataka','234561','8765432109
','rushi@gmail.com'),
    -> ('Shruti','Gaikawad','Haveri','Haveri','Karnataka','345612','7654321098',
'shruti@gmail.com');
Query OK, 3 rows affected (2.26 sec)
Records: 3  Duplicates: 0  Warnings: 0

mysql> SELECT * FROM addressbook;
+-----------+----------+-----------+-----------+-------------+---------+-------------+------------------+
| firstName | lastName | address   | city      | state       | zipCode | phoneNumber | email            |
+-----------+----------+-----------+-----------+-------------+---------+-------------+------------------+
| Rushi     | Patil    | Bangalore | Bangalore | Karnataka   |  234561 |  8765432109 | rushi@gmail.com  |
| Shruti    | Gaikawad | Haveri    | Haveri    | Karnataka   |  345612 |  7654321098 | shruti@gmail.com |
| Snehal    | Patil    | Sangli    | Sangli    | Maharashtra |  123456 |  9876543210 | snehal@gmail.com |
+-----------+----------+-----------+-----------+-------------+---------+-------------+------------------+
3 rows in set (0.06 sec)


//---------------------UC4--------------------------------


mysql> UPDATE addressbook SET phoneNumber= '99999999999' where firstName= 'Snehal';
Query OK, 1 row affected (0.16 sec)
Rows matched: 1  Changed: 1  Warnings: 0

mysql> SELECT * FROM addressbook;
+-----------+----------+-----------+-----------+-------------+---------+-------------+------------------+
| firstName | lastName | address   | city      | state       | zipCode | phoneNumber | email            |
+-----------+----------+-----------+-----------+-------------+---------+-------------+------------------+
| Rushi     | Patil    | Bangalore | Bangalore | Karnataka   |  234561 |  8765432109 | rushi@gmail.com  |
| Shruti    | Gaikawad | Haveri    | Haveri    | Karnataka   |  345612 |  7654321098 | shruti@gmail.com |
| Snehal    | Patil    | Sangli    | Sangli    | Maharashtra |  123456 |  9999999999 | snehal@gmail.com |
+-----------+----------+-----------+-----------+-------------+---------+-------------+------------------+
3 rows in set (0.02 sec)

